{
  "version": "1.0",
  "description": "旧字体→新字体マッピング（江戸時代古文書OCR補正用）",
  "note": "direction: old→new（異体字・旧字体を現代標準字体へ正規化）",
  "items": [
    {"old": "國", "new": "国", "yomi": "くに",     "category": "常用"},
    {"old": "學", "new": "学", "yomi": "まなぶ",   "category": "常用"},
    {"old": "經", "new": "経", "yomi": "へる",     "category": "常用"},
    {"old": "體", "new": "体", "yomi": "からだ",   "category": "常用"},
    {"old": "發", "new": "発", "yomi": "はつ",     "category": "常用"},
    {"old": "傳", "new": "伝", "yomi": "つたえる", "category": "常用"},
    {"old": "寶", "new": "宝", "yomi": "たから",   "category": "元号"},
    {"old": "萬", "new": "万", "yomi": "まん",     "category": "数詞"},
    {"old": "曆", "new": "暦", "yomi": "こよみ",   "category": "元号"},
    {"old": "祿", "new": "禄", "yomi": "ろく",     "category": "元号"},
    {"old": "德", "new": "徳", "yomi": "とく",     "category": "元号"},
    {"old": "應", "new": "応", "yomi": "おう",     "category": "元号"},
    {"old": "寬", "new": "寛", "yomi": "かん",     "category": "元号"},
    {"old": "綠", "new": "緑", "yomi": "みどり",   "category": "色"},
    {"old": "黃", "new": "黄", "yomi": "き",       "category": "色"},
    {"old": "黑", "new": "黒", "yomi": "くろ",     "category": "色"},
    {"old": "氣", "new": "気", "yomi": "き",       "category": "常用"},
    {"old": "藥", "new": "薬", "yomi": "くすり",   "category": "常用"},
    {"old": "賣", "new": "売", "yomi": "うる",     "category": "常用"},
    {"old": "圖", "new": "図", "yomi": "ず",       "category": "常用"},
    {"old": "讀", "new": "読", "yomi": "よむ",     "category": "常用"},
    {"old": "號", "new": "号", "yomi": "ごう",     "category": "常用"},
    {"old": "條", "new": "条", "yomi": "じょう",   "category": "法律・公文書"},
    {"old": "禪", "new": "禅", "yomi": "ぜん",     "category": "宗教"},
    {"old": "佛", "new": "仏", "yomi": "ほとけ",   "category": "宗教"},
    {"old": "靈", "new": "霊", "yomi": "れい",     "category": "宗教"},
    {"old": "歲", "new": "歳", "yomi": "とし",     "category": "暦"},
    {"old": "彌", "new": "弥", "yomi": "や",       "category": "人名・地名"},
    {"old": "濱", "new": "浜", "yomi": "はま",     "category": "地名"},
    {"old": "澤", "new": "沢", "yomi": "さわ",     "category": "地名"},
    {"old": "龍", "new": "竜", "yomi": "りゅう",   "category": "常用"},
    {"old": "龜", "new": "亀", "yomi": "かめ",     "category": "常用"},
    {"old": "壽", "new": "寿", "yomi": "ことぶき", "category": "常用"},
    {"old": "繪", "new": "絵", "yomi": "え",       "category": "常用"},
    {"old": "惠", "new": "恵", "yomi": "めぐむ",   "category": "人名"},
    {"old": "禮", "new": "礼", "yomi": "れい",     "category": "常用"},
    {"old": "齊", "new": "斉", "yomi": "ととのう", "category": "常用"},
    {"old": "顯", "new": "顕", "yomi": "あらわす", "category": "常用"},
    {"old": "劍", "new": "剣", "yomi": "けん",     "category": "常用"},
    {"old": "藏", "new": "蔵", "yomi": "くら",     "category": "常用"},
    {"old": "廣", "new": "広", "yomi": "ひろい",   "category": "常用"},
    {"old": "濟", "new": "済", "yomi": "すむ",     "category": "常用"},
    {"old": "變", "new": "変", "yomi": "かわる",   "category": "常用"},
    {"old": "鐵", "new": "鉄", "yomi": "てつ",     "category": "常用"},
    {"old": "爲", "new": "為", "yomi": "ため",     "category": "常用"},
    {"old": "與", "new": "与", "yomi": "あたえる", "category": "常用"},
    {"old": "來", "new": "来", "yomi": "くる",     "category": "常用"},
    {"old": "實", "new": "実", "yomi": "み",       "category": "常用"},
    {"old": "眞", "new": "真", "yomi": "まこと",   "category": "常用"},
    {"old": "關", "new": "関", "yomi": "せき",     "category": "常用"},
    {"old": "豐", "new": "豊", "yomi": "ゆたか",   "category": "常用"},
    {"old": "舊", "new": "旧", "yomi": "ふるい",   "category": "常用"},
    {"old": "戀", "new": "恋", "yomi": "こい",     "category": "常用"},
    {"old": "戰", "new": "戦", "yomi": "いくさ",   "category": "常用"},
    {"old": "獸", "new": "獣", "yomi": "けもの",   "category": "常用"},
    {"old": "歸", "new": "帰", "yomi": "かえる",   "category": "常用"},
    {"old": "聲", "new": "声", "yomi": "こえ",     "category": "常用"},
    {"old": "縣", "new": "県", "yomi": "けん",     "category": "行政"},
    {"old": "辭", "new": "辞", "yomi": "やめる",   "category": "常用"},
    {"old": "當", "new": "当", "yomi": "あたる",   "category": "常用"},
    {"old": "獨", "new": "独", "yomi": "ひとり",   "category": "常用"},
    {"old": "蟲", "new": "虫", "yomi": "むし",     "category": "常用"},
    {"old": "稻", "new": "稲", "yomi": "いね",     "category": "農業"},
    {"old": "雙", "new": "双", "yomi": "ふたつ",   "category": "常用"},
    {"old": "彈", "new": "弾", "yomi": "はずむ",   "category": "常用"},
    {"old": "擔", "new": "担", "yomi": "になう",   "category": "常用"},
    {"old": "壤", "new": "壌", "yomi": "つち",     "category": "農業"},
    {"old": "齡", "new": "齢", "yomi": "よわい",   "category": "常用"},
    {"old": "聽", "new": "聴", "yomi": "きく",     "category": "常用"},
    {"old": "覺", "new": "覚", "yomi": "おぼえる", "category": "常用"},
    {"old": "亂", "new": "乱", "yomi": "みだれる", "category": "常用"}
  ]
}
